{
  "taskName": "salary_h_count_day",
  "tableName": "salary_h_count",
  "columns": [
    {
      "name": "count",
      "type": "long"
    },
    {
      "name": "type",
      "type": "string"
    }
  ],
  "steps": [
    {
      "sql": "SELECT count(*) as count,'day' as type FROM foxconn_h_group_salary_one WHERE unix_timestamp(create_time,'yyyyMMddHHmmss')>=unix_timestamp('#{biz_date}', 'yyyyMMdd')",
      "tempView": "m",
      "macros": {
        "#{biz_date}": ""
      }
    }
  ],
  "version": "1.0"
}