{
  "taskName": "salary_fii_cesgb_count",
  "tableName": "salary_fii_cesgb_count",
  "columns": [
    {
      "name": "count",
      "type": "long"
    },
    {
      "name": "type",
      "type": "string"
    }
  ],
  "steps": [
    {
      "sql": "SELECT COUNT(*) as count,'total' as type FROM (SELECT DISTINCT emp_no FROM foxconn_fii_group_salary_cesgb) t",
      "tempView": "t",
      "macros": {}
    }
  ],
  "version": "1.0"
}